{
  "id": "grpc-unary-draft",
  "title": "gRPC unary draft (schema shape only)",
  "environment": "ift",
  "tags": ["draft"],
  "steps": [
    {
      "id": "charge",
      "type": "grpc.unary",
      "description": "Draft gRPC unary call (not executable yet)",
      "target": "billing-grpc",
      "method": "billing.BillingService/Charge",
      "correlation": { "inject": true },
      "request": { "fixture": "fixtures/charge-request.json" },
      "timeout": "5s",
      "expect": { "status": "OK" }
    }
  ]
}
